{
  "apiVersion": "workload-intake.leorunners.io/v1",
  "kind": "WorkloadIntake",
  "metadata": { "name": "controller-ci-intake", "version": "1.0.0" },
  "spec": {
    "repository": {
      "url": "https://github.com/manish96170/leoRunners",
      "commit": "3d8acb1904854728572e7f45459255f7f2113858",
      "workflow": ".github/workflows/ci.yml",
      "workflowDigest": "sha256:aaaaaaaaaaaaaaaaaaaaaaaaaaaaaaaaaaaaaaaaaaaaaaaaaaaaaaaaaaaaaaaa"
    },
    "workload": {
      "id": "controller-ci",
      "manifestPath": "workloads/workload-manifest.v1.yaml",
      "manifestDigest": "sha256:bbbbbbbbbbbbbbbbbbbbbbbbbbbbbbbbbbbbbbbbbbbbbbbbbbbbbbbbbbbbbbbb",
      "command": "cd controller && go test ./...",
      "commandDigest": "sha256:3c964eca7067c2d505c40d3076fe152704d65c44bb7dc5d4d8b75bbbfa8b338e",
      "shell": "bash"
    },
    "provenance": {
      "source": "repository-defined",
      "inspectedAt": "2026-09-14T00:00:00Z",
      "submittedBy": "platform-owner",
      "approval": {
        "requestId": "req-phase60-intake",
        "approvedBy": "platform-owner",
        "approvedAt": "2026-09-14T00:00:00Z",
        "expiresAt": "2026-09-15T00:00:00Z",
        "purpose": "fixed workload contract validation"
      }
    },
    "toolRequirements": [
      { "name": "go", "version": "1.27.1", "source": "approved-image" },
      { "name": "bash", "version": "5.2.0", "source": "system" }
    ],
    "observations": {
      "cache": { "mode": "observe-only", "namespaceObserved": true, "keysRedacted": true },
      "network": { "egressMode": "none", "endpointsObserved": [], "externalAccessApproved": false },
      "security": { "trustClass": "trusted-branch", "isolationProfile": "isolated", "capabilitiesObserved": ["workspace", "go-toolchain"] }
    },
    "redaction": { "status": "redacted", "secretsScanned": true, "rawPayloadsExcluded": true, "identifiersHashed": true },
    "comparability": {
      "protocolId": "workload-intake-1",
      "comparisonKey": "controller-ci:linux-x86_64:isolated",
      "fixedCommit": "3d8acb1904854728572e7f45459255f7f2113858",
      "fixedManifestDigest": "sha256:bbbbbbbbbbbbbbbbbbbbbbbbbbbbbbbbbbbbbbbbbbbbbbbbbbbbbbbbbbbbbbbb",
      "fixedCommandDigest": "sha256:3c964eca7067c2d505c40d3076fe152704d65c44bb7dc5d4d8b75bbbfa8b338e"
    }
  }
}
